{
  "v": 1,
  "version": 12,
  "published": "2026-08-25T09:00:00Z",
  "expires": "2026-09-25T09:00:00Z",
  "entries": [
    {
      "domain": "example-fashion.com",
      "brand_terms": ["example fashion"],
      "authorized_domains": ["example-fashion.com", "examplefashion.co.uk"],
      "policy": "closed"
    },
    {
      "domain": "example-bank.co.uk",
      "brand_terms": ["example bank"],
      "authorized_domains": ["example-bank.co.uk"],
      "policy": "none"
    },
    {
      "domain": "example-coffee.com",
      "brand_terms": ["example coffee"],
      "authorized_domains": ["example-coffee.com"],
      "policy": "open"
    }
  ]
}
